{
  "contract": "target_status",
  "contract_version": "1.0.0",
  "letter": "H",
  "letter_name": "analysis",
  "targets": [
    {
      "number": 20,
      "slug": "victre-pipeline",
      "name": "FDA VICTRE pipeline",
      "priority": 2,
      "kind": "classical",
      "papers": [
        "H03"
      ],
      "state": "dissected",
      "rejection_reason": null,
      "reproduced": {
        "quantity": "SE(DeltaAUC), VICTRE heterogeneous design",
        "paper_value": "0.0073",
        "our_value": "[0.0033, 0.0051]",
        "unit": "AUC",
        "agreement": "no",
        "sim_mode": "n/a",
        "figure": "figures/r20b_mrmc_se.png"
      },
      "claim_level": null,
      "sim_mode": null,
      "dossier": "dossiers/20-victre-pipeline.md",
      "figures": [
        "figures/r20a_cho_vs_ideal.png",
        "figures/r20b_mrmc_se.png"
      ],
      "updated": "2026-10-29"
    },
    {
      "number": 21,
      "slug": "ai-rad-companion",
      "name": "Siemens AI-Rad Companion Chest CT (documented-interface black box)",
      "priority": 1,
      "kind": "classical",
      "papers": [],
      "state": "dissected",
      "rejection_reason": null,
      "reproduced": null,
      "claim_level": null,
      "sim_mode": null,
      "dossier": "dossiers/21-ai-rad-companion.md",
      "figures": [],
      "updated": "2026-10-29"
    }
  ]
}
