{
  "contract": "target_status",
  "contract_version": "1.0.0",
  "letter": "B",
  "letter_name": "mapping",
  "targets": [
    {
      "number": 1,
      "slug": "bn-circuit-compiler",
      "name": "Bayesian-network → circuit compiler (Low–Yoder–Chuang; Borujeni)",
      "priority": 3,
      "kind": "quantum",
      "papers": [
        "B01",
        "B09",
        "B10"
      ],
      "state": "adapted",
      "rejection_reason": null,
      "reproduced": {
        "quantity": "Borujeni oil-stock BN, RMSPE of marginals (simulator)",
        "paper_value": "0.1 %",
        "our_value": "0.36 % (mcry), 0.18 % (ancilla); marginals within ±0.01 of Netica",
        "agreement": "match (criterion: marginals ±0.01, RMSPE ≤ 0.5 %)",
        "unit": "%",
        "sim_mode": "ideal",
        "figure": "figures/borujeni_rmspe_vs_level.png"
      },
      "claim_level": "L0",
      "sim_mode": "both",
      "dossier": "dossiers/01-bn-circuit-compiler.md",
      "figures": [
        "figures/borujeni_rmspe_vs_level.png",
        "figures/drift_b1_b2.png"
      ],
      "updated": "2026-10-29"
    },
    {
      "number": 2,
      "slug": "quantum-enhanced-mcmc",
      "name": "Quantum-enhanced MCMC (Layden; Ferguson–Wallden)",
      "priority": 2,
      "kind": "quantum",
      "papers": [
        "B11",
        "B12"
      ],
      "state": "adapted",
      "rejection_reason": null,
      "reproduced": {
        "quantity": "spectral-gap exponent k_quantum (gap ∝ 2^(-kn))",
        "paper_value": "0.264(4); local 0.94(4); uniform 0.948(7)",
        "our_value": "0.250; local 1.017; uniform 0.939",
        "agreement": "match within ±0.08 (quantum) / ±0.15 (baselines); speedup is ideal-simulation only",
        "unit": "k",
        "sim_mode": "ideal",
        "figure": "figures/layden_gap_scaling.png"
      },
      "claim_level": null,
      "sim_mode": "both",
      "dossier": "dossiers/02-quantum-enhanced-mcmc.md",
      "figures": [
        "figures/layden_gap_scaling.png"
      ],
      "updated": "2026-10-29"
    },
    {
      "number": 3,
      "slug": "quantum-blur",
      "name": "Quantum blur (Wootton)",
      "priority": 1,
      "kind": "quantum",
      "papers": [
        "B04",
        "B05"
      ],
      "state": "rejected",
      "rejection_reason": "Classical Gaussian blur is equivalent where the quantum blur acts as a spatial blur (r = 0.97 2-D, 0.99 3-D at θ = 0.1π); at larger θ it scrambles coordinate bits non-locally. No advantage.",
      "reproduced": null,
      "claim_level": null,
      "sim_mode": "ideal",
      "dossier": "dossiers/03-quantum-blur.md",
      "figures": [
        "figures/quantum_blur_vs_gaussian.png"
      ],
      "updated": "2026-10-29"
    }
  ]
}
